{
  "_schema_id": "https://raw.githubusercontent.com/VervaekeLab/NANSEN/dev/schemas/dependencies.nansen.json",
  "_schema_version": "1.0",
  "_type": "NANSEN Dependency Manifest",
  "scope": "core",
  "scopeId": "core",
  "dependencies": [
    {
      "name": "TestToolboxA",
      "dependencyType": "community-toolbox",
      "requirementLevel": "required",
      "source": "https://github.com/test-org/TestToolboxA",
      "description": "Required core community toolbox for testing",
      "installCheck": "TestToolboxACheck"
    },
    {
      "name": "TestToolboxB",
      "dependencyType": "community-toolbox",
      "requirementLevel": "optional",
      "source": "fex://99999-test-toolbox-b",
      "description": "Optional core community toolbox for testing",
      "installCheck": "TestToolboxBCheck",
      "reason": "Enables optional test feature"
    },
    {
      "name": "Image Processing Toolbox",
      "dependencyType": "mathworks-product",
      "requirementLevel": "required",
      "reason": "Required MathWorks product for testing"
    },
    {
      "name": "Parallel Computing Toolbox",
      "dependencyType": "mathworks-product",
      "requirementLevel": "optional",
      "reason": "Optional MathWorks product for testing"
    }
  ]
}
